{
  "schema_version": "1.0.0",
  "id": "id-example-0001",
  "name": "name-example-0001",
  "version": "1.0.0",
  "released_at": "2026-07-26T12:00:00Z",
  "upstream": {},
  "license": {},
  "artifacts": [
    {
      "schema_version": "1.0.0",
      "id": "id-example-0001",
      "kind": "document",
      "uri": "https://example.org/artifact",
      "digest": "sha256:aaaaaaaaaaaaaaaaaaaaaaaaaaaaaaaaaaaaaaaaaaaaaaaaaaaaaaaaaaaaaaaa",
      "classification": "public",
      "created_at": "2026-07-26T12:00:00Z",
      "source_system": "source_system-example-0001"
    }
  ],
  "training_data_manifests": [
    "example-training-dat"
  ],
  "evaluation_result_ids": [
    "example-evaluation-r"
  ],
  "runtime_profiles": [
    {}
  ],
  "cards": [
    {
      "schema_version": "1.0.0",
      "id": "id-example-0001",
      "kind": "document",
      "uri": "https://example.org/artifact",
      "digest": "sha256:aaaaaaaaaaaaaaaaaaaaaaaaaaaaaaaaaaaaaaaaaaaaaaaaaaaaaaaaaaaaaaaa",
      "classification": "public",
      "created_at": "2026-07-26T12:00:00Z",
      "source_system": "source_system-example-0001"
    }
  ],
  "manifest_digest": "sha256:aaaaaaaaaaaaaaaaaaaaaaaaaaaaaaaaaaaaaaaaaaaaaaaaaaaaaaaaaaaaaaaa"
}
